author,published,title,text,language,site_url,main_img_url,type,label,title_without_stopwords,text_without_stopwords,hasImage
Dr. Patrick Slattery,2016-10-27T19:01:11.700+03:00,clinton policy on syria would lead to ww iii trump,"clintons nofly zone over syria will lead to war with russia warning of jcs chairman general dunford october   at  am global research  october   the media has failed to address the confrontation between the us state department and the joint chiefs of staff 
the chairman of the joint chiefs of staff general joseph francis dunford image right has warned both the us senate as well secretary of state john kerry in no uncertain terms that a no fly zone over syria would lead to war with both syria and russia intimating a dangerous process of military escalation 
in a senate arms services committee hearing dunford said responding to questions from republican senator roger whicker mississippi 
right now senator for us to control all of the airspace in syria it would require us to go to war against syria and russia thats a pretty fundamental decision that certainly im not going to make  senate armed services committee september   emphasis added 
at the third presidential debate hillary clinton reasserted her commitment that if elected president she would implement a noflyzone intimating that the objective was to save lives 
i think a nofly zone could save lives and could hasten the end of the conflict i am well aware of the really legitimate concerns you have expressed from both the president and the general clinton said in response to a question from fox news debate moderator chris wallace 
this would not be done just on the first day this would take a lot of negotiation and would also take making it clear to the russians and syrians that our purpose here was to provide safe zones on the ground  i think we could strike a deal and make it clear to the russians and the syrians that this was something that we believe was in the best interest of the people on the ground in syria fox news emphasis added 
at present under the obama administration the joint chiefs of staff are opposed to the no fly zone 
the joint chiefs of staff are appointed by the secretary of defense 
under a clinton presidency a new secretary of defense as well as a new chairman of the joint chiefs of staff firmly committed to a no fly zone over syria would be appointed 
michèle angelique flournoy a former under secretary of defense for policy is hillarys choice for the position of secretary of defense who favors the no fly zone option 
according to defense one the woman expected to run the pentagon under hillary clinton said she would direct us troops to push president bashar alassads forces out of southern syria and would send more american boots to fight the islamic state in the region 
confirmed by the leaked emails michele flournoy is a crony of the clintons she has called for limited military coercion to help remove assad from power in syria including a no bombing zone over parts of syria held by usbacked rebels this is tantamount to a no fly zone to protect the terrorists including isis daesh from actions by syrian and russian forces 
according to defense one flournoy and several of her colleagues at the center for new american security or cnas have been making the case for sending more american troops into combat against isis and the assad regime than the obama administration has been willing to commit
since russias increased involvement the facts on the ground in syria she said do not support the kind of negotiated conditions we would like to get to us policy should be the removal of assad even if that meant using limited military coercion flournoy said at mondays annual cnas conference in washington 
flournoy did not deny the entire report that she favors increased us intervention for instance she acknowledged her support for us strikes using standoff weapons  to retaliate against syrian military targets to enforce the nobomb zone 
the press reports however did not quote the details of the discussion and testimony of general dunford and secretary of defense carter at the arms services committee hearing let me see if the chairman wants to add anything
senator wicker well let me just ask this if you dont mind secretary carter it would help if the barrel bombing ended and i spoke to a democratic colleague of mine today ive been calling for a nofly zone to stop the barrel bombing and i asked this colleague of mine on the other side of the aisle if he would support that and he said yes he said i want to call it something else rather than a nofly zone but that this particular senator it is a fact that this particular senator has now changed his position and would like us to take action to present  to prevent the barrel bombing 
what is your position about that and wouldnt it help if we took decisive action and ended this carnage 
secretary carter i dont know the specific proposal which youre discussing with your colleague ill make one comment and see if the chairman wants to add anything 
senator wicker i think he was talking about a nofly zone  
secretary carter well okay 
senator wicker  but described in more palatable terms 
secretary carter there are  a number of different proposals have been made but i  the one that i think it the focus on right now is the one secretary kerrys trying to promote namely a nofly zone for the russians and the syrians who are attacking the syrian people if theyre talking about a nofly zone for american aircraft fighting isil needless to say that  thats not going to get any enthusiasm get strong opposition from me 
senator wicker im speaking about a  
secretary carter but i think thats what a  but  its not called that but secretary kerry is trying to get a standdown of the syrian and russian air force and if hes successful that would be a good thing 
let me ask the chairman if he has anything to add 
general dunford senator the only thing id say is you know as the situation on the ground changes i think i have a responsibility  we the joint force has a responsibility  to make sure the president has a full range of options we have discussed that issue in the past under certain conditions the conditions on the ground will change and well continue to look at those options and make sure theyre available to the president 
senator wicker what about the option of controlling the airspace so that barrel bombs cannot be dropped 
general dunford all options  
senator wicker what do you think of that option sir 
general dunford right now senator for all of the airspace in syria it would require war against syria and russia thats a pretty fundamental decision that certainly im not going to make 

concluding remarks 
from the above testimonies and statements one thing is clear decisionmakers at highest levels of the us government and the military believe in their own propaganda they are not able to reflect on their actions outside the realm of propaganda and this also applies to nuclear warfare which is presented as a peacemaking operation 
it is unlikely that any drastic action regarding a no fly zone will be taken under the obama administration prior to the november elections and the instatement of a new president of the us in january  
consequently the next three months will be absolutely crucial for syria ie during this period the counterterrorism campaign waged by syria with the support of russia and iran will seek to eliminate remaining terrorist pockets and pacify the entire country 
the footsoldiers of the western military alliance will be defeated on the ground if this objective is achieved it will inevitably have an impact on us options regarding the proposed deployment of groundforces and the no fly zone what prevails however is an attempt on the part of washington to redeploy its isis terrorist footsoldiers in mosul by transferring them from iraq to syria the original source of this article is global research",english,davidduke.com,https://s0.wp.com/i/blank.jpg,hate,Real,clinton policy syria would lead ww iii trump,clintons nofly zone syria lead war russia warning jcs chairman general dunford october global research october media failed address confrontation us state department joint chiefs staff chairman joint chiefs staff general joseph francis dunford image right warned us senate well secretary state john kerry uncertain terms fly zone syria would lead war syria russia intimating dangerous process military escalation senate arms services committee hearing dunford said responding questions republican senator roger whicker mississippi right senator us control airspace syria would require us go war syria russia thats pretty fundamental decision certainly im going make senate armed services committee september emphasis added third presidential debate hillary clinton reasserted commitment elected president would implement noflyzone intimating objective save lives think nofly zone could save lives could hasten end conflict well aware really legitimate concerns expressed president general clinton said response question fox news debate moderator chris wallace would done first day would take lot negotiation would also take making clear russians syrians purpose provide safe zones ground think could strike deal make clear russians syrians something believe best interest people ground syria fox news emphasis added present obama administration joint chiefs staff opposed fly zone joint chiefs staff appointed secretary defense clinton presidency new secretary defense well new chairman joint chiefs staff firmly committed fly zone syria would appointed michèle angelique flournoy former secretary defense policy hillarys choice position secretary defense favors fly zone option according defense one woman expected run pentagon hillary clinton said would direct us troops push president bashar alassads forces southern syria would send american boots fight islamic state region confirmed leaked emails michele flournoy crony clintons called limited military coercion help remove assad power syria including bombing zone parts syria held usbacked rebels tantamount fly zone protect terrorists including isis daesh actions syrian russian forces according defense one flournoy several colleagues center new american security cnas making case sending american troops combat isis assad regime obama administration willing commit since russias increased involvement facts ground syria said support kind negotiated conditions would like get us policy removal assad even meant using limited military coercion flournoy said mondays annual cnas conference washington flournoy deny entire report favors increased us intervention instance acknowledged support us strikes using standoff weapons retaliate syrian military targets enforce nobomb zone press reports however quote details discussion testimony general dunford secretary defense carter arms services committee hearing let see chairman wants add anything senator wicker well let ask dont mind secretary carter would help barrel bombing ended spoke democratic colleague mine today ive calling nofly zone stop barrel bombing asked colleague mine side aisle would support said yes said want call something else rather nofly zone particular senator fact particular senator changed position would like us take action present prevent barrel bombing position wouldnt help took decisive action ended carnage secretary carter dont know specific proposal youre discussing colleague ill make one comment see chairman wants add anything senator wicker think talking nofly zone secretary carter well okay senator wicker described palatable terms secretary carter number different proposals made one think focus right one secretary kerrys trying promote namely nofly zone russians syrians attacking syrian people theyre talking nofly zone american aircraft fighting isil needless say thats going get enthusiasm get strong opposition senator wicker im speaking secretary carter think thats called secretary kerry trying get standdown syrian russian air force hes successful would good thing let ask chairman anything add general dunford senator thing id say know situation ground changes think responsibility joint force responsibility make sure president full range options discussed issue past certain conditions conditions ground change well continue look options make sure theyre available president senator wicker option controlling airspace barrel bombs cannot dropped general dunford options senator wicker think option sir general dunford right senator airspace syria would require war syria russia thats pretty fundamental decision certainly im going make concluding remarks testimonies statements one thing clear decisionmakers highest levels us government military believe propaganda able reflect actions outside realm propaganda also applies nuclear warfare presented peacemaking operation unlikely drastic action regarding fly zone taken obama administration prior november elections instatement new president us january consequently next three months absolutely crucial syria ie period counterterrorism campaign waged syria support russia iran seek eliminate remaining terrorist pockets pacify entire country footsoldiers western military alliance defeated ground objective achieved inevitably impact us options regarding proposed deployment groundforces fly zone prevails however attempt part washington redeploy isis terrorist footsoldiers mosul transferring iraq syria original source article global research,1
Dr. Patrick Slattery,2016-11-01T21:55:49.836+02:00,dr david duke and adrian salbuch  the international impact of a us president trump and us senator duke,"dr david duke storms into the senate debate tonight fighting to take our country back november   at  am 
dr david duke storms into the senate debate tonight fighting to take our country back 
today dr duke talked about how the corrupt media controls the political system and manipulates our elections he brought up the example of the polls which can never really be random and are manipulated by selective sampling these polling results then impact the selection of voters who dont want to waste their vote on someone they feel has no chance of winning 
he talked about his debate tonight which will be live on cspan you can find the livestreaming information here dr slattery joined the show and spoke of the fact that even if donald trump becomes president european americans will not have a single voice representing their interests in washington unless david duke wins his race for the senate 

our show is aired live at  am replayed at et pm eastern and am eastern",english,davidduke.com,https://s0.wp.com/i/blank.jpg,hate,Real,dr david duke adrian salbuch international impact us president trump us senator duke,dr david duke storms senate debate tonight fighting take country back november dr david duke storms senate debate tonight fighting take country back today dr duke talked corrupt media controls political system manipulates elections brought example polls never really random manipulated selective sampling polling results impact selection voters dont want waste vote someone feel chance winning talked debate tonight live cspan find livestreaming information dr slattery joined show spoke fact even donald trump becomes president european americans single voice representing interests washington unless david duke wins race senate show aired live replayed et pm eastern eastern,1
Shawn Helton,2016-11-04T00:03:00.000+02:00,partners in crime goldman sachs the clintons  wall street,"st century wire says 
this should be the biggest revelation yet from wikileaks already epic email trove will the us media cover this story 
last night in an rt exclusive interview conducted by awardwinning filmmaker john pilger wikileaks editor and founder julian assange described what he believes is the most significant email in the whole collection 
wikileaks reveals an early  email where the outgoing secretary of state hillary clinton was urging john podesta  then advisor to president barack obama to bring pressure on gulf states saudi arabia and qatar which are providing clandestine financial and logistic support to isil islamic state is isis and other radical sunni groups 
this constitutes proof that the clinton foundation knowingly accepting millions of dollars in charitable donations from the same gulf states which both secretary clinton and president obama knew were funding isis al nusra front al qaeda in syria and known takfiri terrorist fighting organizations 
in addition the clintons foundation took money from a number of other gulf monarchies 
infographic conservative post  
this latest news validates what wire has been saying since the isis crisis began in june  
according to fox news  fbi sources have said that indictments are likely for the clinton foundation investigation one only wonders how this latest assange revelation will factor into the wider investigation  as it goes right to the heart of the national security and foreign policy  two things which clinton trades heavily on in her campaigning 
assange went on to explain the deep ramifications of this latest criminal allegation against clinton and her family foundation 
all serious analysts know and even the us government has agreed that some saudi figures have been supporting isis and funding isis but the dodge has always been that it is some rogue princes using their oil money to do whatever they like but actually the government disapproves but that email says that it is the government of saudi arabia and the government of qatar that have been funding isis 
during their minute interview filmed at the ecuadorian embassy in london assange and pilger discussed the obvious conflict of interest between clinton as secretary of state the clinton foundation and gulf monarchies who financed them the following is an excerpt from the interview transcript 
john pilger the saudis the qataris the moroccans the bahrainis particularly the first two are giving all this money to the clinton foundation while hillary clinton is secretary of state and the state department is approving massive arms sales particularly saudi arabia 
julian assange under hillary clinton  and the clinton emails reveal a significant discussion of it  the biggestever arms deal in the world was made with saudi arabia more than  billion during her tenure the total arms exports from the us doubled in dollar value 
jp of course the consequence of that is that this notorious jihadist group called isil or isis is created largely with money from people who are giving money to the clinton foundation 
ja yes 
watch a brief preview of the interview here 
the interview will air in full on rt international this saturday nov th 
read more clinton news at st century wire clinton files 
support wire  subscribe  become a member wiretv",english,21stcenturywire.com,http://i2.wp.com/21stcenturywire.com/wp-content/uploads/2016/10/Clinton-Gold-21WIRE-SLIDER-SH.jpg?fit=620%2C415,conspiracy,Fake,partners crime goldman sachs clintons wall street,st century wire says biggest revelation yet wikileaks already epic email trove us media cover story last night rt exclusive interview conducted awardwinning filmmaker john pilger wikileaks editor founder julian assange described believes significant email whole collection wikileaks reveals early email outgoing secretary state hillary clinton urging john podesta advisor president barack obama bring pressure gulf states saudi arabia qatar providing clandestine financial logistic support isil islamic state isis radical sunni groups constitutes proof clinton foundation knowingly accepting millions dollars charitable donations gulf states secretary clinton president obama knew funding isis al nusra front al qaeda syria known takfiri terrorist fighting organizations addition clintons foundation took money number gulf monarchies infographic conservative post latest news validates wire saying since isis crisis began june according fox news fbi sources said indictments likely clinton foundation investigation one wonders latest assange revelation factor wider investigation goes right heart national security foreign policy two things clinton trades heavily campaigning assange went explain deep ramifications latest criminal allegation clinton family foundation serious analysts know even us government agreed saudi figures supporting isis funding isis dodge always rogue princes using oil money whatever like actually government disapproves email says government saudi arabia government qatar funding isis minute interview filmed ecuadorian embassy london assange pilger discussed obvious conflict interest clinton secretary state clinton foundation gulf monarchies financed following excerpt interview transcript john pilger saudis qataris moroccans bahrainis particularly first two giving money clinton foundation hillary clinton secretary state state department approving massive arms sales particularly saudi arabia julian assange hillary clinton clinton emails reveal significant discussion biggestever arms deal world made saudi arabia billion tenure total arms exports us doubled dollar value jp course consequence notorious jihadist group called isil isis created largely money people giving money clinton foundation ja yes watch brief preview interview interview air full rt international saturday nov th read clinton news st century wire clinton files support wire subscribe become member wiretv,1
CASTIEL,2016-11-15T05:07:00.000+02:00,re the election of donald trump is already having an enormous impact on the economy,more criminal elements for trump to deport,english,theeconomiccollapseblog.com,http://theeconomiccollapseblog.com/wp-content/uploads/2016/11/Great-Seal-On-The-Dollar-Public-Domain-460x345.jpg,bs,Fake,still danger zone january th,campaigning nonstop hillary hardly think fine attending grand opening trump trump trump,1
