author,published,title,text,language,site_url,main_img_url,type,label,title_without_stopwords,text_without_stopwords,hasImage
Staff,2016-11-15T01:37:13.686+02:00,david duke on cnn," views share 
dr david duke offers a new paradigm for humanity read and listen to this amazing statement that will create a revolution in the concept of human rights a recognition of the absolute right of every people to preserve its human diversity independence and freedom the right of every people to preserve its culture traditions art forms and characteristics of society 
a path to peace and harmonious nations and societies why we must resist globalist destruction of freedom globalist forms of economic and financial slavery and globalist zionist wars 
in the power of its reason love and understanding this declaration of human diversity and freedom can be the moral engine to saving our european heritage and truly the rights of every people on earth the foundation of human freedom 
i believe that each of us must be committed to the preservation of human diversity i cherish not only the value of every form of life on earth in what we call biodiversity but also respect and honor the diversity of mankind i believe that every people has the right to preserve their expression of humanity its own heritage and culture that every people on earth has the right rule themselves and the right to be free and independent 
human freedom is the principle that all peoples must be free to be different humanity is not one it is many destroying the variety diversity and freedom of a diverse humanity is a destruction of humanity itself 
not recognizing the inborn urge of every people to express their essence in their own forms of art music culture religion societal structure and government leads to human conflict and often to violence and human suffering on a horrific scale 
much of the worlds conflicts are not because peoples and cultures are different but because they are not allowed to be different because globalists and imperialists seek to expand their empires they want to control the resources and economy of all nations and destroy real human diversity human differences in values cultures economies religions and their freedom and independence to preserve and celebrated those differences stand in the way of the globalists who want to regiment mankind and make them soulless consumers human diversity is natural 
human life is expressed in a multitude of diverse peoples created by geographic and social adaption over the course of thousands of years whether we celebrate human diversity as the handiwork of nature or in a religious sense as the creation of god we celebrate the rich tapestry of different peoples and cultures across the earth 
we believe that every people and culture has the right to preserve its unique expression of humanity that every people has the right to maintain and enrich its unique culture to nurture its particular expressions of art music literature philosophies architecture religion diet traditions and values that make every people unique and add beauty and possibility for mankind 
we believe that every people has the right to be politically free and independent and not be ruled over or exploited by any other people or nation and we reject the globalist power that seeks to destroy the independence and freedom of every people and destroy human diversity every people must have the right to self preservation and freedom 
we believe that every free people has the right to live in a harmonious society created in its own image its own nature and spirit 
for example the people of tibet have the human right to live in a society oriented to the heritage culture and tradition of that nation as should all peoples today the tibetan people are threatened by massive nontibetan immigration forced by an imperial power meant to marginalize the heritage and culture of tibetan people in their own homeland the loss of the unique people and culture of tibet is a horrific loss for them and truly a loss for all of humanity what is true for tibet and the tibetan people is true for every people on earth we believe that the people of tibet and every nation have the right to defend their borders and an inherent human right to preserve its unique ethnic and cultural character and its freedom and independence 
nations more similar in their cultural ethnic religious and social traditions are tend to be far more harmonious that those wracked with internal cultural ethnic or religious divisions 
we also affirm that states with significant ethnic and cultural minorities tend to be more happy peaceful and cooperative when each group has the freedom to an autonomy that makes each group feel more at home in society 
if one looks honestly at the world he quickly recognizes that the greatest source of civil conflict hatreds wars genocide and other horrific human rights violations comes from ethnic conflict often accompanied by religious conflict and when that happens it is like putting a fuse into dynamite 
it is a truism that if you want to reduce ethnic conflict you must endeavor to give every people the human right to live and to create society and community in its own values and that every group respect the right of every other group to do this 
we believe that these endemic conflicts are rooted in supranational states and globalist denial of the reality of human diversity and denial of the natural human desire of people to live in a society reflecting their own heritage traditions culture and values one size does not fit all 
instead of recognizing this reality the globalists and empire builders seek to destroy the distinctions of humanity so they will become more compliant to their control and exploitation instead of accepting the reality of human nature and truly the diversity of all life including human life the globalists continue to promote destructive policies that destroy the harmony of traditional societies and historical character of nations massive immigration of diverse peoples into another peoples living space produces conflict not harmony 
we believe that massive forced immigration of nonindigenous people into other peoples lands is almost always against the will of the indigenous people 
and this leads to civil repression conflict hatreds violence one does not have to look much further than the palestinian nakba or the massive immigration into tibet as examples of this universal truth but this reality is just as true in europe and other areas of the world that have undergone massive immigration into it regions and nation states 
look at the riots and deep social unrest and conflict that have befallen traditional harmonious societies that have experienced massive unwanted immigration 
a world of independent cultures is true diversity and freedom 
a multicultural state does not contribute to human diversity it does not contribute to human happiness peace and harmony it more often than not lessens human love and human rights no matter what the high motive it produces more disharmony than harmony more discord than accord 
just as in the natural world every life form needs its own living space and needs the preservation of its own ecosystem to survive and flourish so it is true for every people of humanity 
every people needs a living space and ecocultural system in which it can thrive ignoring this reality leads to conflict diverse human peoples and cultures and religions competing in a limited living space is the greatest single cause of civil war and crimes against humanity 
united nations studies show ethnic cultural and religious conflicts within nations are the primary engines of civil conflict and war which takes an enormous toll in human suffering numbering hundreds of millions of dead injured and dispossessed human beings 
this urge to diversity has always been in mankind and always will be not to recognize this elemental part of mankinds nature is the progenitor of conflict 
in fact with the rise of the idea that people have the right to be free ethnic conflict is increasing as the imperial states created by conquest can no longer repress the desire of diverse people for their freedom and ethnic expression 
nations whose rulers have established immigration policies ignoring human differences are increasingly divided and conflicted trying to change the natural urge toward freedom is like screaming against the tide 
the global elite in government and media which has a huge stake in trying to regiment the worlds populations tell us we are all the same and they endeavor to destroy every unique culture and human expression  
they attempt to change human nature but history and an increasingly conflicted world show that this is like screaming against the tide 
better to recognize human nature and within that context support national and regional freedom that lessons conflict and supports mutual respect 
it is time to teach the new ethic that recognizes the human right of every people to exist and thrive however those who seek their own peoples freedom must understand that these rights must be afforded to every people and any effort toward this worthy goal must be in the spirit of not destroying the rights of others and to peaceful resolution of the conflicts 
it is far better to recognize these realities and inherent desires of humanity and avoid as much human conflict as possible than to try to destroy human distinctions in pursuit of imperialist empire or globalist regimentation and conformity even if the destruction of peoples is based on a utopian vision because it goes against basic human nature it ultimately leads not to a dreamed of peace and love between people but to conflict and hate attempts to control exploit or harm any people is a crime against humanity 
we must condemn violence and the harming or destruction of any people we must adopt a clear human ethic that attempts to control or exploit any other nation or people is a crime against humanity 
we support human freedom and we support human diversity and we support the right of every people to have their own nation or society but we do not support supremacism control or repression of any other people efforts to control or exploit is a crime against humanity 
as a person of european descent i see that much of the repressive globalism damaging the world originates in mostly european peopled nations that are today called the west i see that this globalism not only damages and harms the worlds diversity of peoples but that it harms my own people and i have learned that we must not allow this exploitation of our own heritage and be just as committed to the well being of all of humanity 
this is a lifechanging lesson that i have learned in my own life as a very young man i joined a nonviolent klan organization in my community like so many young people across the world i longed to identify with my own people to defend the heritage that i love and that i believed was threatened 
but still as a young man i left the organization because i came to realize i have no moral right to speak about human rights for my own people unless i embrace the idea of the same human rights for every people and further that we must be committed to securing human rights not with war not with violence not with human suppression but the power of human ideas and ideals 
i believe that the vast majority of the earths people believe in the principles i set forth here in my own life i further realized that other peoples have the same the desires for their own peoples heritage and rights that i have for mine 
i realize fully that only in a context of genuine commitment to respect the rights and freedoms of all humanity can one morally campaign for your own peoples fundamental rights defending the diversity of humanity is a defense of humanity itself 
there is nothing wrong with a people defending their own rights and heritage in fact defending and preserving the diversity of humanity is defense of humanity itself 
but it must come with a genuine concern for the rights and heritage of all 
in that context and only with that understanding can we move toward peaceful resolutions of social religious and ethnic conflicts and at the same time preserve our own heritage and the diversity and freedom of humanity 
nations that have an overwhelmingly unifying heritage culture religious and social tradition have the right to preserve their expression of humanity and their societal harmony 
it is a crime to destroy those values in pursuit of socalled multiculturalism and if one wants to see where massive immigration of alien peoples cultures and religions lead just look to what happened in the warravaged now dismembered nation once called yugoslavia look to the cultural and ethnic genocide in tibet look to the tribal and religious conflicts in many nations of the mideast 
group differences run deep even though the muslim quran repeatedly teaches muslim unity still some extremist elements of shiites and sunnis blow up the children of each other in the others holy places of worship nor did the admonitions of jesus christ against violence and for love and reconciliation stop irish catholics and scottishderived protestants from a cascade of violence that has lead to the death of countless innocents 
although we understand the historical motives of mass immigration of one people into another peoples lands we must not continue to repeat those mistakes in the modern world and create more divided and strifetorn communities regions and nations models of self rule and societal harmony 
and just as a majority has the human right to live in a social fabric in harmony with its history and values so minorities must be accorded their human right to have their own communities or regions that reflect their own essence or helped to migrate to a sovereign region of compatriots 
this is human freedom and this is human rights on the most fundamental level those nations with significant minorities of diverse people should strive toward recognizing their desire for freedom and self expression 
autonomy within nations such as the german language speaking south tyrol region of north italy and the italian french and germanspeaking cantons of switzerland offer models of how recognition of differences in language heritage ethnicity and a liberal degree of autonomy can lead to a more peaceful national fabric 
nation states that seek imperial power through the conquering and subjection of other peoples are now coming apart at the seams because of the inherent will to freedom and identity that grow in suppressed people 
even european nations divided by slight differences in history identity genetics and culture seek this freedom the artificially created nation of czechoslovakia was composed of czechs and slovaks held together by  years of intense totalitarian physical suppression propaganda and conditioning 
when the communist tyranny collapsed they used their new freedom to create the independent states of the czech republic and the slovak republic 
they did this with mutual respect and not war and without horrific crimes against humanity 
contrast that to the artificially created state of yugoslavia created in name of empire and then held together under a ruthless authoritarian regime when communism fell people wedded to old ideas of empire tried desperately to hold on to control over vast areas of diverse peoples as a result a long war and brutality and massive crimes against humanity occurred on both sides of the conflict 
how much better if all parties in the conflict had embraced the ethic that all people have a right to self rule and self expression in their own regions take for example two of the many peoples trapped in the old yugoslavia the serbians and the croatians even though serbians may have dominated the government of yugoslavia to effectively control other peoples such a totalitarian state must suppress the natural differences in people and force a regimentation and conformity 
so even the serbian people lost some of their unique identity as well as the other peoples over whom they ruled people now warmly embrace the right of serbians and croatians to be themselves and rule themselves globalism is a continuation of yugoslavian totalitarianism on a global scale 
ironically the serbians and the croatians and indeed all of us face globalist tyrants demanding to control the economy of serbia and croatia their currencies controlled by new york and london rather than by their own people and increasingly they are subject to a media controlled by hollywood and new york rather than the spirit of their own traditional heritage and values 
and in the height of insanity the globalists are eyeing mass immigration into both serbia and croatia of massive numbers of noneuropean immigrants who are far more fundamentally different than serbs and croats a prescription for future human conflict the rights of both majorities and minorities 
there are many harmonious nations on earth that are overwhelmingly of one primary heritage with only minor differences among their inhabitants 
but nations corrupted by the globalist power and media elite and propagandized that humanity is one and not many go against the peoples will and usher in massive immigration of an alien population 
this process is almost always against the democratic will of the nations inhabitants as history repeatedly shows and then as the numbers increase and societal differences and conflicts and discord increase the globalists resort to the old totalitarian tactics of suppressing free speech free association and all kinds of human liberty even to the point of forbidding the public displays of the traditional culture of the vast majority 
a powerful example is how the american government has now made it illegal to display a christian christmas motif on public ground even in an overwhelmingly christian cultural nation america supposedly created by e pluribus unum out of the many one is now dominated by identity and ethnic politics 
the most powerful lobby in american politics by far is for instance the jewish lobby comprised of an ethnic group of two percent of the american people but driven by ethnic and religious supremacism jewish organizations lead the fight in the destruction of christian christmas traditions 
the political landscape of america is dominated by special interest groups to which every politician must now bow except of course the european american majority which must silently watch as its cultural traditions such as christmas are destroyed of course it goes far beyond christmas americans are experiencing increasing identity politics and division such as generated by massive illegal immigration the rights of small nations cannot be sacrificed 
on the international level it must be recognized as a crime against humanity for any imperial state to occupy another peoples lands for exploitation of its labor or resources where autonomy or independent regions are not possible a degree of autonomy is certainly possible where significant groups in an area can have community institutions schools and other structures oriented toward both their needs and their spirit 
it is time to stand for freedom for all peoples it is time to stand up to globalist destruction of biodiversity destruction of human diversity destruction of the earths indigenous cultures artistic expressions lifestyles traditions and independence zionist globalism is actually supremacism 
the globalists seek the destruction of every unique expression of humanity they want to destroy the unique character of your people and every people on the earth 
they seek to destroy the human diversity of the earth so they can more easily rule over all of us and market the same brands of junk movies media and music they want you and all of us to consume the same junk food from a world agribusiness and media that advertises it that not only destroys the planets ecosystems but destroys your health and the health of hundreds of millions of people spawning epidemics of obesity heart disease diabetes and other ills 
they want to control the value of the currency in your pocket and force you and your nation under a corrupt zionistcontrolled global banking system that exploits you and all of us and put whole nations and peoples as slaves in a perpetual debt 
they want to put you and all of us under a soulless globalist government that takes away your freedom and that of every people and every nation 
and these globalists want war perpetual wars and conflicts in their attempts to expand their power over the earth and over all people 
they grow stronger by divide and conquer tactics and they seek to stamp out human diversity and seek to regiment all of humanity to their new world order all while the new york centered globalist media supports israel as a quote jewish state and supports zionist control of the international banks and the globalist media so in reality zionistdriven globalism is actually form of jewish supremacism 
globalism is imperialism on a global level and the greatest threat to human freedom diversity and independence in all of world history yes to freedom yes to diversity and independence 
but my dear friends all over the world in my homeland of america and that of my brethren in europe but among all freedom loving people across the globe millions of us say no to globalism 
we say yes to freedom yes to human diversity and independence 
we say no to globalist wars such as the iraq war the afghanistan war the planned war on iran horrific wars that are part of the zionist globalist agenda 
we say no to the zionist dominated globalist media that spout the lies that fuel these wars 
we say yes to a free internet and the freedom of people create their own media literature music and art forms no longer will we drink the toxic poisons of the globalist elite 
we say no to globalism yes to human freedom yes to human diversity yes to world of peace and prosperity 
we say yes to every peoples striving to preserve their way of life their particular heritage their particular expression of humanity 
whether we are kurds or pakistanis or iranians or palestinians whether we are chinese or japanese or africans or indians or of european heritage we say no to globalism 
we say yes to human freedom and global diversity we say yes to the peoples of our own nations and societies determining our destiny 
we say no to the global corporations and huge imperial powers wiping out human diversity in pursuit of their ungodly power we say yes to preserving our heritage and our way of life yes to our independence and freedom no matter who we are or where we live upon the earth 
we are humanity we are many 
because we honor our own heritage and traditions we honor every heritage and tradition 
because we value our own freedom and independence we value the freedom and independence of every people on earth 
because we refuse to be economically exploited we pledge not to exploit other s 
just as most europeans now want to preserve their own heritage and cultures we refuse to support the globalists who seek to use us to control and exploit other nations around the world 
because we love peace we refuse to support their zionistdriven globalist wars a new paradigm of human rights 
this is a new affirmation of human rights a new paradigm it is the human freedom movement and it is found wherever there are free people who desire to preserve their heritage and freedom 
it is found where people yearn for human societies allowed to be as naturally diverse as the biodiversity in nature 
the globalists have global economic media political and military power but we represent the true desires of humanity for freedom 
we represent the natural desires of every majority population to want to preserve the character of their nation and people and every minority population who seeks more freedom and autonomy in their own communities or regions human diversity freedom and independence 
we must resist rule of the globalists over us with a global coalition of mutually free peoples 
we are rising in every nation 
our paradigm for human freedom and diversity is growing among people all over the world 
the globalists cannot rule over us without our consent they cannot defeat us if we rise in defense of human freedom and diversity not just for ourselves but as a new principle for all mankind good for all people on this planet 
the principles we stand for we hold for our own people and for every people on the face the earth 
this is the world i am committed to the humanity i am committed to the nation in my own land that i am committed to 
i hope you join me in this quest for a new paradigm for humanity a new commitment to human freedom and diversity 

dr david duke 
postscript 
as i publish this most recent updated edition zionist jewish supremacists are committing mass murder against the people of gaza we must support gaza gaza is a symbol today of the need for global freedom from the tyranny of zionism free palestine free europe and the western world free the world",english,davidduke.com,http://davidduke.com/wp-content/uploads/2016/11/CNN-interview2.jpg,hate,Real,david duke cnn,views share dr david duke offers new paradigm humanity read listen amazing statement create revolution concept human rights recognition absolute right every people preserve human diversity independence freedom right every people preserve culture traditions art forms characteristics society path peace harmonious nations societies must resist globalist destruction freedom globalist forms economic financial slavery globalist zionist wars power reason love understanding declaration human diversity freedom moral engine saving european heritage truly rights every people earth foundation human freedom believe us must committed preservation human diversity cherish value every form life earth call biodiversity also respect honor diversity mankind believe every people right preserve expression humanity heritage culture every people earth right rule right free independent human freedom principle peoples must free different humanity one many destroying variety diversity freedom diverse humanity destruction humanity recognizing inborn urge every people express essence forms art music culture religion societal structure government leads human conflict often violence human suffering horrific scale much worlds conflicts peoples cultures different allowed different globalists imperialists seek expand empires want control resources economy nations destroy real human diversity human differences values cultures economies religions freedom independence preserve celebrated differences stand way globalists want regiment mankind make soulless consumers human diversity natural human life expressed multitude diverse peoples created geographic social adaption course thousands years whether celebrate human diversity handiwork nature religious sense creation god celebrate rich tapestry different peoples cultures across earth believe every people culture right preserve unique expression humanity every people right maintain enrich unique culture nurture particular expressions art music literature philosophies architecture religion diet traditions values make every people unique add beauty possibility mankind believe every people right politically free independent ruled exploited people nation reject globalist power seeks destroy independence freedom every people destroy human diversity every people must right self preservation freedom believe every free people right live harmonious society created image nature spirit example people tibet human right live society oriented heritage culture tradition nation peoples today tibetan people threatened massive nontibetan immigration forced imperial power meant marginalize heritage culture tibetan people homeland loss unique people culture tibet horrific loss truly loss humanity true tibet tibetan people true every people earth believe people tibet every nation right defend borders inherent human right preserve unique ethnic cultural character freedom independence nations similar cultural ethnic religious social traditions tend far harmonious wracked internal cultural ethnic religious divisions also affirm states significant ethnic cultural minorities tend happy peaceful cooperative group freedom autonomy makes group feel home society one looks honestly world quickly recognizes greatest source civil conflict hatreds wars genocide horrific human rights violations comes ethnic conflict often accompanied religious conflict happens like putting fuse dynamite truism want reduce ethnic conflict must endeavor give every people human right live create society community values every group respect right every group believe endemic conflicts rooted supranational states globalist denial reality human diversity denial natural human desire people live society reflecting heritage traditions culture values one size fit instead recognizing reality globalists empire builders seek destroy distinctions humanity become compliant control exploitation instead accepting reality human nature truly diversity life including human life globalists continue promote destructive policies destroy harmony traditional societies historical character nations massive immigration diverse peoples another peoples living space produces conflict harmony believe massive forced immigration nonindigenous people peoples lands almost always indigenous people leads civil repression conflict hatreds violence one look much palestinian nakba massive immigration tibet examples universal truth reality true europe areas world undergone massive immigration regions nation states look riots deep social unrest conflict befallen traditional harmonious societies experienced massive unwanted immigration world independent cultures true diversity freedom multicultural state contribute human diversity contribute human happiness peace harmony often lessens human love human rights matter high motive produces disharmony harmony discord accord natural world every life form needs living space needs preservation ecosystem survive flourish true every people humanity every people needs living space ecocultural system thrive ignoring reality leads conflict diverse human peoples cultures religions competing limited living space greatest single cause civil war crimes humanity united nations studies show ethnic cultural religious conflicts within nations primary engines civil conflict war takes enormous toll human suffering numbering hundreds millions dead injured dispossessed human beings urge diversity always mankind always recognize elemental part mankinds nature progenitor conflict fact rise idea people right free ethnic conflict increasing imperial states created conquest longer repress desire diverse people freedom ethnic expression nations whose rulers established immigration policies ignoring human differences increasingly divided conflicted trying change natural urge toward freedom like screaming tide global elite government media huge stake trying regiment worlds populations tell us endeavor destroy every unique culture human expression attempt change human nature history increasingly conflicted world show like screaming tide better recognize human nature within context support national regional freedom lessons conflict supports mutual respect time teach new ethic recognizes human right every people exist thrive however seek peoples freedom must understand rights must afforded every people effort toward worthy goal must spirit destroying rights others peaceful resolution conflicts far better recognize realities inherent desires humanity avoid much human conflict possible try destroy human distinctions pursuit imperialist empire globalist regimentation conformity even destruction peoples based utopian vision goes basic human nature ultimately leads dreamed peace love people conflict hate attempts control exploit harm people crime humanity must condemn violence harming destruction people must adopt clear human ethic attempts control exploit nation people crime humanity support human freedom support human diversity support right every people nation society support supremacism control repression people efforts control exploit crime humanity person european descent see much repressive globalism damaging world originates mostly european peopled nations today called west see globalism damages harms worlds diversity peoples harms people learned must allow exploitation heritage committed well humanity lifechanging lesson learned life young man joined nonviolent klan organization community like many young people across world longed identify people defend heritage love believed threatened still young man left organization came realize moral right speak human rights people unless embrace idea human rights every people must committed securing human rights war violence human suppression power human ideas ideals believe vast majority earths people believe principles set forth life realized peoples desires peoples heritage rights mine realize fully context genuine commitment respect rights freedoms humanity one morally campaign peoples fundamental rights defending diversity humanity defense humanity nothing wrong people defending rights heritage fact defending preserving diversity humanity defense humanity must come genuine concern rights heritage context understanding move toward peaceful resolutions social religious ethnic conflicts time preserve heritage diversity freedom humanity nations overwhelmingly unifying heritage culture religious social tradition right preserve expression humanity societal harmony crime destroy values pursuit socalled multiculturalism one wants see massive immigration alien peoples cultures religions lead look happened warravaged dismembered nation called yugoslavia look cultural ethnic genocide tibet look tribal religious conflicts many nations mideast group differences run deep even though muslim quran repeatedly teaches muslim unity still extremist elements shiites sunnis blow children others holy places worship admonitions jesus christ violence love reconciliation stop irish catholics scottishderived protestants cascade violence lead death countless innocents although understand historical motives mass immigration one people another peoples lands must continue repeat mistakes modern world create divided strifetorn communities regions nations models self rule societal harmony majority human right live social fabric harmony history values minorities must accorded human right communities regions reflect essence helped migrate sovereign region compatriots human freedom human rights fundamental level nations significant minorities diverse people strive toward recognizing desire freedom self expression autonomy within nations german language speaking south tyrol region north italy italian french germanspeaking cantons switzerland offer models recognition differences language heritage ethnicity liberal degree autonomy lead peaceful national fabric nation states seek imperial power conquering subjection peoples coming apart seams inherent freedom identity grow suppressed people even european nations divided slight differences history identity genetics culture seek freedom artificially created nation czechoslovakia composed czechs slovaks held together years intense totalitarian physical suppression propaganda conditioning communist tyranny collapsed used new freedom create independent states czech republic slovak republic mutual respect war without horrific crimes humanity contrast artificially created state yugoslavia created name empire held together ruthless authoritarian regime communism fell people wedded old ideas empire tried desperately hold control vast areas diverse peoples result long war brutality massive crimes humanity occurred sides conflict much better parties conflict embraced ethic people right self rule self expression regions take example two many peoples trapped old yugoslavia serbians croatians even though serbians may dominated government yugoslavia effectively control peoples totalitarian state must suppress natural differences people force regimentation conformity even serbian people lost unique identity well peoples ruled people warmly embrace right serbians croatians rule globalism continuation yugoslavian totalitarianism global scale ironically serbians croatians indeed us face globalist tyrants demanding control economy serbia croatia currencies controlled new york london rather people increasingly subject media controlled hollywood new york rather spirit traditional heritage values height insanity globalists eyeing mass immigration serbia croatia massive numbers noneuropean immigrants far fundamentally different serbs croats prescription future human conflict rights majorities minorities many harmonious nations earth overwhelmingly one primary heritage minor differences among inhabitants nations corrupted globalist power media elite propagandized humanity one many go peoples usher massive immigration alien population process almost always democratic nations inhabitants history repeatedly shows numbers increase societal differences conflicts discord increase globalists resort old totalitarian tactics suppressing free speech free association kinds human liberty even point forbidding public displays traditional culture vast majority powerful example american government made illegal display christian christmas motif public ground even overwhelmingly christian cultural nation america supposedly created e pluribus unum many one dominated identity ethnic politics powerful lobby american politics far instance jewish lobby comprised ethnic group two percent american people driven ethnic religious supremacism jewish organizations lead fight destruction christian christmas traditions political landscape america dominated special interest groups every politician must bow except course european american majority must silently watch cultural traditions christmas destroyed course goes far beyond christmas americans experiencing increasing identity politics division generated massive illegal immigration rights small nations cannot sacrificed international level must recognized crime humanity imperial state occupy another peoples lands exploitation labor resources autonomy independent regions possible degree autonomy certainly possible significant groups area community institutions schools structures oriented toward needs spirit time stand freedom peoples time stand globalist destruction biodiversity destruction human diversity destruction earths indigenous cultures artistic expressions lifestyles traditions independence zionist globalism actually supremacism globalists seek destruction every unique expression humanity want destroy unique character people every people earth seek destroy human diversity earth easily rule us market brands junk movies media music want us consume junk food world agribusiness media advertises destroys planets ecosystems destroys health health hundreds millions people spawning epidemics obesity heart disease diabetes ills want control value currency pocket force nation corrupt zionistcontrolled global banking system exploits us put whole nations peoples slaves perpetual debt want put us soulless globalist government takes away freedom every people every nation globalists want war perpetual wars conflicts attempts expand power earth people grow stronger divide conquer tactics seek stamp human diversity seek regiment humanity new world order new york centered globalist media supports israel quote jewish state supports zionist control international banks globalist media reality zionistdriven globalism actually form jewish supremacism globalism imperialism global level greatest threat human freedom diversity independence world history yes freedom yes diversity independence dear friends world homeland america brethren europe among freedom loving people across globe millions us say globalism say yes freedom yes human diversity independence say globalist wars iraq war afghanistan war planned war iran horrific wars part zionist globalist agenda say zionist dominated globalist media spout lies fuel wars say yes free internet freedom people create media literature music art forms longer drink toxic poisons globalist elite say globalism yes human freedom yes human diversity yes world peace prosperity say yes every peoples striving preserve way life particular heritage particular expression humanity whether kurds pakistanis iranians palestinians whether chinese japanese africans indians european heritage say globalism say yes human freedom global diversity say yes peoples nations societies determining destiny say global corporations huge imperial powers wiping human diversity pursuit ungodly power say yes preserving heritage way life yes independence freedom matter live upon earth humanity many honor heritage traditions honor every heritage tradition value freedom independence value freedom independence every people earth refuse economically exploited pledge exploit europeans want preserve heritage cultures refuse support globalists seek use us control exploit nations around world love peace refuse support zionistdriven globalist wars new paradigm human rights new affirmation human rights new paradigm human freedom movement found wherever free people desire preserve heritage freedom found people yearn human societies allowed naturally diverse biodiversity nature globalists global economic media political military power represent true desires humanity freedom represent natural desires every majority population want preserve character nation people every minority population seeks freedom autonomy communities regions human diversity freedom independence must resist rule globalists us global coalition mutually free peoples rising every nation paradigm human freedom diversity growing among people world globalists cannot rule us without consent cannot defeat us rise defense human freedom diversity new principle mankind good people planet principles stand hold people every people face earth world committed humanity committed nation land committed hope join quest new paradigm humanity new commitment human freedom diversity dr david duke postscript publish recent updated edition zionist jewish supremacists committing mass murder people gaza must support gaza gaza symbol today need global freedom tyranny zionism free palestine free europe western world free world,1
