author,published,title,text,language,site_url,main_img_url,type,label,title_without_stopwords,text_without_stopwords,hasImage
No Author,2016-10-26T19:22:00.000+03:00,massive increase reported in illegal immigrants coming across southern border,if youre a democrat you lie its what you do too bad switching to geiko cant save us from all their lies,english,westernjournalism.com,http://static.westernjournalism.com/wp-content/uploads/2016/10/donaldtrump-2.jpg,bias,Real,title,conspiracy bull stit,1
Henry Wolff,2016-10-29T04:39:10.675+03:00,dutch antiislam mp wilders to snub hate speech trial,"lukas mikelionis heat street october   
snip according to misao dean professor of english at the university of victoria the canoe can be a symbol of colonialism imperialism and genocide due to history she also accused the canoers of cultural appropriation because they are primarily white men and have a privileged place in society 
in a radio interview for cbc radio  which wasnt picked up by the internet until several months later she claimed we have a whole set of narratives that make the canoe into a kind of morally untouchable symbol something that seems natural that seems ordinary and seems to promote values that we ascribe to 
but i think if you look a little further that narrative obscures or erases another narrativeand that narrative is about to be blunt its about theft and genocide the professor said 
snip 
its not a coincidence that it was white men of a certain age    certainly the majority of wilderness canoers are people who have a very privileged place in society theyre frequently highly educated people theyre almost completely white she said 
cbc radio host jim brown then asked a question should we look at the canoe as a noncontroversial symbol or should we look at it as a symbol of colonialism 
to which the academic replied absolutely a symbol of colonialism it seems to me that this narrative we tell ourselves about the canoe about how canoeing makes us in touch with nature how canoeing makes us in some way guiltless of the terrible things that the canadian government and canadians in general did to first nations people 
snip 
either way somebody should break the news to canadas woke prime minister justin trudeau about this its  after all thrilled to let you know were going to need another seat in our canoe sophie is pregnant threeisthenewtwo pictwittercomgmbwaep",english,amren.com,http://www.amren.com/wp-content/uploads/2014/03/AmRen.jpg,bs,Fake,dutch antiislam mp wilders snub hate speech trial,lukas mikelionis heat street october snip according misao dean professor english university victoria canoe symbol colonialism imperialism genocide due history also accused canoers cultural appropriation primarily white men privileged place society radio interview cbc radio wasnt picked internet several months later claimed whole set narratives make canoe kind morally untouchable symbol something seems natural seems ordinary seems promote values ascribe think look little narrative obscures erases another narrativeand narrative blunt theft genocide professor said snip coincidence white men certain age certainly majority wilderness canoers people privileged place society theyre frequently highly educated people theyre almost completely white said cbc radio host jim brown asked question look canoe noncontroversial symbol look symbol colonialism academic replied absolutely symbol colonialism seems narrative tell canoe canoeing makes us touch nature canoeing makes us way guiltless terrible things canadian government canadians general first nations people snip either way somebody break news canadas woke prime minister justin trudeau thrilled let know going need another seat canoe sophie pregnant threeisthenewtwo pictwittercomgmbwaep,1
Fed Up,2016-11-11T15:13:00.000+02:00,boom this is how president reagan handled protesters negotiate what is there to negotiate video  percentfedupcom,go to article a trump supporter wearing a trumppence tshirt let it fly on a reporter from msnbc because of his one sided reporting and the demonizing of trump this is one brave woman new yorkers have had enough of the protests and violence  calmsnbc is having an interesting day pictwittercomemelmqamau,english,100percentfedup.com,http://100percentfedup.com/wp-content/uploads/2016/11/reagan.jpg,bias,Real,boom president reagan handled protesters negotiate negotiate video percentfedupcom,go article trump supporter wearing trumppence tshirt let fly reporter msnbc one sided reporting demonizing trump one brave woman new yorkers enough protests violence calmsnbc interesting day pictwittercomemelmqamau,1
Dr. Patrick Slattery,2016-11-09T20:23:49.158+02:00,dr david duke and pastor dankof discuss the magnificent victory of donald trump against the globalist warmongers and criminals," views share 
dr david duke releases an interview with himself undertaken by cnn on presidentelect donald trump and his viewswhich was of course unused by that broadcaster",english,davidduke.com,https://s0.wp.com/i/blank.jpg,hate,Real,dr david duke pastor dankof discuss magnificent victory donald trump globalist warmongers criminals,views share dr david duke releases interview undertaken cnn presidentelect donald trump viewswhich course unused broadcaster,1
admin,2016-10-26T20:36:00.000+03:00,obamacare architect on rising premiums its not a big increase,"college reform october   
grinnell college is promoting a guide to help students avoid cultural appropriation this halloween warning that some costumes could be considered deplorable and problematic 
the guide provides several examples of costumes that might fit the definition of cultural appropriation defining the term as the act of displaying peoples cultures in a disrespectful or condescending manner 
the guide called my identity not your costume goes on to list several examples of offensive halloween costumes featuring pictures of grinnell students holding photos of costumes that would be considered disrespectful towards their culture 
in one instance the guide shows a picture of a burly white man dressed in lingerie with a sash proclaiming call me caitlyn referring to caitlyn jenner the photo is held by a grinnell student wearing a national coming out day pin and includes a caption stating the misrepresentation of my identity bothers me because people categorize me by my looks and may not understand my culture 
another example of culturally appropriated halloween costumes according to the guide is using other cultures as accessories to appear more hipinteresting without adequate understanding or permission one example of which is a picture of someone dressed as a hindu deity being held by an indian student and the message that such costumes are deplorable and problematic 
it then warns students that if their costumes take defining characteristics of another culture without permission or understanding of the historical background behind the said culture then these costumes might be too offensive to wear 
the guide then concludes with two questions the school thinks students should consider before selecting a halloween costume asking does your costume perpetuate stereotypes or inaccurately portray my culture as a joke as well as why would i find your halloween costume to be offensive 
campus reform reached out to grinnell for a comment on the matter but did not receive a response in time for publication this article was posted thursday october   at  am share this article",english,prisonplanet.com,http://static.infowars.com/images/INFOWARS_stacked.jpg,conspiracy,Fake,team clinton lets talk russia wikileaks emails,bill clinton sexaddicted monster mocked hillary clinton calling warden front friends privately boasted high notch count according longtime mistress childhood friend dolly kyle kyle says decadeslong affair marriage frontrow seat bills salacious doublelife onagain offagain relationship ended abruptly bill clinton allegedly threatened destroy kyle spoke media relationship kyles decades observations shared interview dailymailcom well book woman provide unique perspective clintons marriage couples treatment women accused infidelity sexual assault years kyle arkansas native since befriended several bill clintons sexual assault accusers said determined come forward story hearing hillary clinton say campaign trail women sexually assaulted right believed,1
Henry Wolff,2016-10-27T06:13:00.000+03:00,feds  born to illegals in one year would fill city the size of orlando,"hispanic crowd boos marco rubio off stage rafael bernal the hill october   
sen marco rubio rfla took the stage in orlando at calle orange a puerto ricanthemed festival on sunday when some in the crowd started booing npr reported  
the jeering got louder as the cubanamerican senator seeking reelection after dropping his presidential bid earlier this year was introduced 
and when the emcee asked for applause as rubio took the same boos drowned out any supporters in the crowd npr added 
thank you for having me today rubio said in spanish i want you to enjoy this day were not going to talk about politics today thank god for this beautiful day and for our freedom our democracy our vote and our country god bless you all thank you very much 
he left the stage to more boos from the crowd according to the report 
snip 
rubio is running against rep patrick murphy d and the latest average of polls in the race shows rubio ahead by about  points 
murphys campaign seized on the sunday incident and blasted out video it says shows the booing it also noted that murphy attended the festival with a leader for puerto rican communities rep nydia velazquez while marco rubio was booed off the stage 
rubios campaign shared a video with the hill monday that it says counters what the murphy campaign sent out and shows him being greeted enthusiastically as he moves through the crowd 
snip 
festival attendants said they disapproved of rubios endorsement of trump who is deeply unpopular among hispanics 
when we have someone like trump who hits our mexican brothers our latino brothers then you jump on that bandwagon after all that stuff he says not only about you personally    as a latino youre a freaking sellout i would not vote for him if they paid me calle orange attendant angel marin told npr about rubio 
snip",english,amren.com,http://www.amren.com/wp-content/uploads/2014/03/AmRen.jpg,bs,Fake,feds born illegals one year would fill city size orlando,hispanic crowd boos marco rubio stage rafael bernal hill october sen marco rubio rfla took stage orlando calle orange puerto ricanthemed festival sunday crowd started booing npr reported jeering got louder cubanamerican senator seeking reelection dropping presidential bid earlier year introduced emcee asked applause rubio took boos drowned supporters crowd npr added thank today rubio said spanish want enjoy day going talk politics today thank god beautiful day freedom democracy vote country god bless thank much left stage boos crowd according report snip rubio running rep patrick murphy latest average polls race shows rubio ahead points murphys campaign seized sunday incident blasted video says shows booing also noted murphy attended festival leader puerto rican communities rep nydia velazquez marco rubio booed stage rubios campaign shared video hill monday says counters murphy campaign sent shows greeted enthusiastically moves crowd snip festival attendants said disapproved rubios endorsement trump deeply unpopular among hispanics someone like trump hits mexican brothers latino brothers jump bandwagon stuff says personally latino youre freaking sellout would vote paid calle orange attendant angel marin told npr rubio snip,1
Dr. Patrick Slattery,2016-11-15T01:37:15.948+02:00,the color revolution against trump,"share 
national bugle radio slattery and dankof we won now what 
dr patrick slattery and pastor mark dankof discuss the tremendous victory by donald trump and the disgraceful ongoing attack on him by the media the political establishment and the jewish cabal represented by the likes of george soros who seems to want to spread his color revolutions to america",english,davidduke.com,http://davidduke.com/wp-content/uploads/2016/11/nationwide-anti-trump-protests-show-no-sign-of-letting-up2-e1479165507612.jpg,hate,Real,color revolution trump,share national bugle radio slattery dankof dr patrick slattery pastor mark dankof discuss tremendous victory donald trump disgraceful ongoing attack media political establishment jewish cabal represented likes george soros seems want spread color revolutions america,1
Shawn Helton,2016-10-29T04:22:00.000+03:00,fbi redux whats behind new probe into hillary clinton emails,"a tidal wave of revelations is pouring out of the clinton campaign as the  presidential election draws to a close 
meltdown the clinton campaign continues to unravel following a series of troubling details photo illustration wire 
over the weekend it was discovered through a wikileaks email dump that neera tanden of the center for american progress  john podesta s top aide had an email exchange with michael lux of progressive strategies revealing that the democratic consultant robert creamer of democracy partners was closely allied with clinton campaign manager robby mook  
political bombshell clinton campaign manager robby mook had close ties to disgraced dnc consultant robert creamer image source lockerdome  
creamer gained national attention when he became the subject of video sting operation captured by the investigative nonprofit project veritas  not only was it revealed that the creamer discussed ways to commit voter fraud and violence at donald trump rallies on camera  he also met with white house officials some  times over the past year including  private meetings with president obama or other senior officials 
dnc scandal robert creamer of democracy partners and democratic congresswoman jan schakowsky image source national vanguard  
creamers visits to the white house also included his wife a term illinois democratic congresswoman jan schakowsky  
white house visitor records have shown that schakowsky took  private meetings with obama or his senior staff over the past year the consultancy democracy partners appears to have applied schakowsky as a political buffering point in the event of a fallout over their operations at a grassroots level the nature of this type of procedural separation is to keep certain highranking officials of the hook in case of a massive upheaval over various underhanded campaign tactics  potentially giving the clinton campaign and the dnc plausible deniability 
the mook fallout is the latest in a laundry list of problems for the clinton campaign and comes at a time when interim dnc chair donna brazile  is embroiled in controversy of over leaked debate questions prior to at least two  town hall debates brazile stepped down from her role at cnn earlier in october heres a passage from the daily caller describing the scenario 
donna brazile the interim chair of the democratic national committee began providing town hall and debate questions to the clinton campaign earlier than previously known emails released by wikileaks on monday show 
the article continued by stating that the revelations expose that the interim dnc chair was more deeply involved than previously outlined 
in the march  exchange brazile mentions roland martin by name and offers to provide more than just the one town hall question that she is known to have shared with the campaign 
ill send a few more though some questions roland submitted brazile wrote to palmieri in the march  email thread which is entitled from time to time i get the questions in advance 
martin is a commentator for tv one and the host of news one now  as well as a cnn contributor 
in another matter the wall street journal revealed the following  while disclosing an apparently contentious relationship between the fbi and doj while the fbi appears to be somewhat fractured over the latest email server case developments 
the latest development began in early october when new yorkbased fbi officials notified andrew mccabe of the terry mcauliffe campaign contribution scandal the bureaus secondincommand that while investigating mr weiner for possibly sending sexually charged messages to a teenage minor they had recovered a laptop many of the  emails on the computer they said were from the accounts of ms abedin according to people familiar with the matter 
some critics have called for mccabe to recuse himself after it was revealed his wife received  from a wellknown clinton confidant terry mcauliffe  this was further underlined after the house oversight commitee wanted more information about the senate campaign of dr jill mccabe and its ties to the clintons 
the alleged internal feud among agencies was compounded when attorney general loretta lynch and deputy attorney general sally yates objected to fbi director james comey reopening the clinton email server case this past week  something that added to the lynchclinton tarmac meeting before the first fbi ruling in the clinton case 
according to a report filed by zero hedge  a close friend of podesta peter kadzik  the assistant attorney general of the department of justice doj will be in charge of a probe into huma abedin  clintions closest aide 
interestingly as a mountain of controversy envelops the clinton campaign the fbi is now conducting an early inquiry into former trump campaign manager paul manafort  over his alleged foreign business connections 
back in august the following business connection was revealed by nbc news  
in  according to court records senior trump aide paul manaforts firm was involved with a ukrainian oligarch named dmytro firtash in a plan to redevelop a famous new york hotel the drake the total value of the project was  million firtashs company planned to invest over  million the records say 
that same year firtash acknowledged to the us ambassador in ukraine that he got his start in business with the permission of a notorious russian crime lord according to a classified state department cable other cables say firtash made part of his fortune through sweetheart natural gas deals between russia and the ukraine 
although the us state department has determined that firtash may have ties to a criminal enterprise in russia  so far theres nothing directly linking manafort to any underground element at this time 
watch this space  as the russiatrump meme fostered by mainstream media or some other politically polarizing element will look to deflect from the clinton campaign meltdown 
more from lifezette below 
out of control wikileaks reveals robby mooks links to dnc contractor who discussed ways to commit voter fraud and violence image source slate  
wikileaks trump rally agitator and clinton campaign manager are close 
top clinton aides discussed bob creamer and his grassrootsnetroots operation 
by jim stinson lifezette 
robert creamer the operative behind sending provocateurs to donald trump rallies was close to robby mook hillary clintons campaign manager according to new emails released by wikileaks 
creamer who allegedly spearheaded the dirty tricks for the democrats wasnt just consulting for the democratic national committee according to videos made by project veritas he was sending people to provoke trump at events 
creamer has thus become a redhot issue in the campaign and now its apparent he is close to mook that surprising detail came out sunday morning when wikileaks posted hundreds more emails from john podestas gmail account podesta is clintons campaign chairman whose account was hacked in march 
more from lifezette here  
read more election news at st century wire  files 
support wire  subscribe  become a member wiretv",english,21stcenturywire.com,http://21stcenturywire.com/wp-content/uploads/2016/10/Clinton-New-FBI-Probe-21WIRE-SLIDER-New.jpg,conspiracy,Fake,fbi redux whats behind new probe hillary clinton emails,tidal wave revelations pouring clinton campaign presidential election draws close meltdown clinton campaign continues unravel following series troubling details photo illustration wire weekend discovered wikileaks email dump neera tanden center american progress john podesta top aide email exchange michael lux progressive strategies revealing democratic consultant robert creamer democracy partners closely allied clinton campaign manager robby mook political bombshell clinton campaign manager robby mook close ties disgraced dnc consultant robert creamer image source lockerdome creamer gained national attention became subject video sting operation captured investigative nonprofit project veritas revealed creamer discussed ways commit voter fraud violence donald trump rallies camera also met white house officials times past year including private meetings president obama senior officials dnc scandal robert creamer democracy partners democratic congresswoman jan schakowsky image source national vanguard creamers visits white house also included wife term illinois democratic congresswoman jan schakowsky white house visitor records shown schakowsky took private meetings obama senior staff past year consultancy democracy partners appears applied schakowsky political buffering point event fallout operations grassroots level nature type procedural separation keep certain highranking officials hook case massive upheaval various underhanded campaign tactics potentially giving clinton campaign dnc plausible deniability mook fallout latest laundry list problems clinton campaign comes time interim dnc chair donna brazile embroiled controversy leaked debate questions prior least two town hall debates brazile stepped role cnn earlier october heres passage daily caller describing scenario donna brazile interim chair democratic national committee began providing town hall debate questions clinton campaign earlier previously known emails released wikileaks monday show article continued stating revelations expose interim dnc chair deeply involved previously outlined march exchange brazile mentions roland martin name offers provide one town hall question known shared campaign ill send though questions roland submitted brazile wrote palmieri march email thread entitled time time get questions advance martin commentator tv one host news one well cnn contributor another matter wall street journal revealed following disclosing apparently contentious relationship fbi doj fbi appears somewhat fractured latest email server case developments latest development began early october new yorkbased fbi officials notified andrew mccabe terry mcauliffe campaign contribution scandal bureaus secondincommand investigating mr weiner possibly sending sexually charged messages teenage minor recovered laptop many emails computer said accounts ms abedin according people familiar matter critics called mccabe recuse revealed wife received wellknown clinton confidant terry mcauliffe underlined house oversight commitee wanted information senate campaign dr jill mccabe ties clintons alleged internal feud among agencies compounded attorney general loretta lynch deputy attorney general sally yates objected fbi director james comey reopening clinton email server case past week something added lynchclinton tarmac meeting first fbi ruling clinton case according report filed zero hedge close friend podesta peter kadzik assistant attorney general department justice doj charge probe huma abedin clintions closest aide interestingly mountain controversy envelops clinton campaign fbi conducting early inquiry former trump campaign manager paul manafort alleged foreign business connections back august following business connection revealed nbc news according court records senior trump aide paul manaforts firm involved ukrainian oligarch named dmytro firtash plan redevelop famous new york hotel drake total value project million firtashs company planned invest million records say year firtash acknowledged us ambassador ukraine got start business permission notorious russian crime lord according classified state department cable cables say firtash made part fortune sweetheart natural gas deals russia ukraine although us state department determined firtash may ties criminal enterprise russia far theres nothing directly linking manafort underground element time watch space russiatrump meme fostered mainstream media politically polarizing element look deflect clinton campaign meltdown lifezette control wikileaks reveals robby mooks links dnc contractor discussed ways commit voter fraud violence image source slate wikileaks trump rally agitator clinton campaign manager close top clinton aides discussed bob creamer grassrootsnetroots operation jim stinson lifezette robert creamer operative behind sending provocateurs donald trump rallies close robby mook hillary clintons campaign manager according new emails released wikileaks creamer allegedly spearheaded dirty tricks democrats wasnt consulting democratic national committee according videos made project veritas sending people provoke trump events creamer thus become redhot issue campaign apparent close mook surprising detail came sunday morning wikileaks posted hundreds emails john podestas gmail account podesta clintons campaign chairman whose account hacked march lifezette read election news st century wire files support wire subscribe become member wiretv,1
