author,published,title,text,language,site_url,main_img_url,type,label,title_without_stopwords,text_without_stopwords,hasImage
Mike Rivero,2016-11-17T00:41:00.000+02:00,cbs  minutes withheld trumps appeal to stop attacking minorities and ignored reports of attacks on trump supporters,"november   by wire leave a comment 
william mcgurn wall street journal 
lets get this straight calling hillary clinton a bigot has reporters asking every republican in sight if donald trump has gone too far but the clinton campaign releases a video saying mr trump is the candidate of the ku klux klan and its all okeydokey 
then again mr trump has already been likened to hitler mussolini and stalin small wonder theres a collective hohum when democratic vice presidential nominee tim kaine says mr trump is peddling kkk values 
this is what democrats do it didnt start with mr trump either for years democrats have portrayed the gop as one giant hate group 
each presidential election the drill goes like this 
after republicans nominate someone he immediately finds himself having to prove hes not a hater  of africanamericans of women of gays etc 
this year democrats added a twist mr trump they claim represents a break with all those decent and lovable republicans such as mitt romney  john mccain and george w bush  of course this isnt what they were saying back when these men were running for president 
 in  for example an naacp ad recreated the gruesome murder of james byrd to imply that thengov bush was sympathetic to lynching black men over footage of a chain being dragged by a pickup truck mr byrds daughter says so when gov george w bush refused to support hatecrimes legislation it was like my father was killed all over again 
 when john mccain ran in  barack obama warned that republicans would scare people by saying you know he doesnt look like all those other presidents on those dollar bills the mccain campaign fired back accusing mr obama of playing the race card from the bottom of the deck funny thing all those reporters always hearing dog whistles from republicans somehow didnt hear this one 
 in  when mitt romney went to the naacp and told them facetoface about his opposition to obamacare the stories were all about how he was really just trolling for the racist vote vice president joe biden put it more explicitly telling a largely africanamerican audience that if mr romney were to win hed put yall back in chains 
the only difference today is that republicans now have a nominee giving as good as he gets",english,21stcenturywire.com,http://i0.wp.com/21stcenturywire.com/wp-content/uploads/2016/11/2-Trump-Stahl-60-Minutes-copy.jpg?fit=610%2C415,conspiracy,Fake,cbs minutes withheld trumps appeal stop attacking minorities ignored reports attacks trump supporters,november wire leave comment william mcgurn wall street journal lets get straight calling hillary clinton bigot reporters asking every republican sight donald trump gone far clinton campaign releases video saying mr trump candidate ku klux klan okeydokey mr trump already likened hitler mussolini stalin small wonder theres collective hohum democratic vice presidential nominee tim kaine says mr trump peddling kkk values democrats didnt start mr trump either years democrats portrayed gop one giant hate group presidential election drill goes like republicans nominate someone immediately finds prove hes hater africanamericans women gays etc year democrats added twist mr trump claim represents break decent lovable republicans mitt romney john mccain george w bush course isnt saying back men running president example naacp ad recreated gruesome murder james byrd imply thengov bush sympathetic lynching black men footage chain dragged pickup truck mr byrds daughter says gov george w bush refused support hatecrimes legislation like father killed john mccain ran barack obama warned republicans would scare people saying know doesnt look like presidents dollar bills mccain campaign fired back accusing mr obama playing race card bottom deck funny thing reporters always hearing dog whistles republicans somehow didnt hear one mitt romney went naacp told facetoface opposition obamacare stories really trolling racist vote vice president joe biden put explicitly telling largely africanamerican audience mr romney win hed put yall back chains difference today republicans nominee giving good gets,1
admin,2016-10-27T13:58:44.202+03:00,get ready for civil unrest survey finds that most americans are concerned about election violence,"record numbers say no to proposed handgun ban 
steve   
a new poll released by gallup has found that a record amount of americans are opposed to gun control measures  
the survey found that  percent of respondents over three quarters believe that a ban on civilian ownership of handguns should not be made law 
the findings represent a fourpoint increase on the same survey from last year in addition to an alltime high for the past three decades 
the poll also found that almost two thirds  percent are against a ban on semiautomatic rifles or assault weaponsas the corporate media refers to them 
that figure represents a full tenpoint increase on previous findings and is an all time record high since polling began on the issue  years ago 
just  percent less than a third say they support a ban on handgun ownership while only  percent support a semiautomatic ban an eightpoint decline on previous findings 
in addition gun sales have been hitting record highs for months on end 
in a summary of the new poll gallup seemed surprised by the findings describing waning support for a gun ban as a paradox 
perhaps paradoxically opposition toward a ban has increased against a backdrop of multiple mass shootings and terrorist attacks in which the perpetrators used assault rifles these guns were used in highprofile incidents including the terrorist attacks in san bernardino california and orlando and the mass shootings in aurora colorado and newtown connecticut 
the findings reveal just how out of step hillary clintons position on gun control is with the majority of americans 
hillary is a staunch gun control proponent wikileaks releases have revealed that hillary plans to implement strict gun control measures by executive order 
clinton purportedly plans to open gun manufacturers to lawsuits by crime victims a move that critics say would do nothing to reduce crime but would bankruptand eventually endgun manufacturing in the united states this article was posted thursday october   at  am share this article",english,prisonplanet.com,http://static.infowars.com/images/INFOWARS_stacked.jpg,conspiracy,Fake,guardian front page yearold migrant cries,rt october britain deploying troops aircraft armor biggest military buildup eastern europe since cold war deployment first floated press uk defense chiefs wednesday appears prepared well advance see armored infantry troops deployed estonia royal air force raf fighter jets deployed romania appears reiteration strategy containment employed soviet union cold war france denmark also commit troops wednesday uk defence secretary michael fallon struck belligerent tone wall street journal warned europe continent would defended claimed force would defensive nature pledged would fully combatcapable v e r e e n denied placement small formations around baltic area merely tripwire case muchheralded hypothetical clash russia serious military presence said tensions begun subside fleet russian naval vessels bound mediterranean sea passed north sea english channel passage caused press frenzy uk framed though russia launching invasion british isles royal navy deployed destroyers fallons words manmark vessels raf overflew ships fighter jets according russian military naval groups task ensure naval presence operationally significant areas worlds oceans well safety maritime navigation maritime economic activities russia britains deployment troops drones aircraft expected begin may article posted thursday october share article,1
